[{"trip_id":"a5e4de5b-1304-491a-9e01-155df11ced2f","vehicle_id":"a1b2c3d4-e5f6-7890-abcd-ef1234567890","event_count":16,"avg_speed_kmh":46.63,"max_speed_kmh":51.21,"harsh_braking_count":0,"hard_acceleration_count":0,"distance_km":1.12,"trip_start":"2026-10-03T11:38:39.430057528Z","trip_end":"2026-10-03T11:39:39.430057528Z"},{"trip_id":"0dbca27e-019f-4729-bb93-92132a59d2e6","vehicle_id":"a1b2c3d4-e5f6-7890-abcd-ef1234567890","event_count":15,"avg_speed_kmh":48.48,"max_speed_kmh":53.8,"harsh_braking_count":0,"hard_acceleration_count":0,"distance_km":1.35,"trip_start":"2026-09-29T17:38:39.430057528Z","trip_end":"2026-09-29T17:39:23.430057528Z"},{"trip_id":"c796f1eb-37b5-4164-9f12-c829930a4120","vehicle_id":"a1b2c3d4-e5f6-7890-abcd-ef1234567890","event_count":12,"avg_speed_kmh":45.95,"max_speed_kmh":50.47,"harsh_braking_count":0,"hard_acceleration_count":0,"distance_km":0.67,"trip_start":"2026-09-22T05:38:39.430057528Z","trip_end":"2026-09-22T05:39:12.430057528Z"},{"trip_id":"88a603a1-02c7-44f7-9826-d75e78c1e055","vehicle_id":"a1b2c3d4-e5f6-7890-abcd-ef1234567890","event_count":14,"avg_speed_kmh":46.83,"max_speed_kmh":52.32,"harsh_braking_count":0,"hard_acceleration_count":0,"distance_km":1.16,"trip_start":"2026-10-09T02:38:39.430057528Z","trip_end":"2026-10-09T02:39:27.430057528Z"},{"trip_id":"8658beb3-7f52-4658-a5a1-8d928b73c7f4","vehicle_id":"a1b2c3d4-e5f6-7890-abcd-ef1234567890","event_count":15,"avg_speed_kmh":48.72,"max_speed_kmh":55.76,"harsh_braking_count":0,"hard_acceleration_count":0,"distance_km":1.09,"trip_start":"2026-09-24T02:38:39.430057528Z","trip_end":"2026-09-24T02:39:35.430057528Z"},{"trip_id":"2a843786-b664-4d31-a8f1-53db87c94028","vehicle_id":"a1b2c3d4-e5f6-7890-abcd-ef1234567890","event_count":13,"avg_speed_kmh":45.32,"max_speed_kmh":50.85,"harsh_braking_count":0,"hard_acceleration_count":0,"distance_km":1.28,"trip_start":"2026-09-25T23:38:39.430057528Z","trip_end":"2026-09-25T23:39:15.430057528Z"},{"trip_id":"3be1ce91-56b4-491c-921e-00ee269e18eb","vehicle_id":"a1b2c3d4-e5f6-7890-abcd-ef1234567890","event_count":16,"avg_speed_kmh":47.96,"max_speed_kmh":54.84,"harsh_braking_count":0,"hard_acceleration_count":0,"distance_km":1.64,"trip_start":"2026-10-12T20:38:39.430057528Z","trip_end":"2026-10-12T20:39:27.430057528Z"},{"trip_id":"6280b7e3-74b3-419b-9383-99f0701e9feb","vehicle_id":"a1b2c3d4-e5f6-7890-abcd-ef1234567890","event_count":15,"avg_speed_kmh":46.25,"max_speed_kmh":51.08,"harsh_braking_count":0,"hard_acceleration_count":0,"distance_km":1.36,"trip_start":"2026-10-07T05:38:39.430057528Z","trip_end":"2026-10-07T05:39:19.430057528Z"},{"trip_id":"fecfa0a4-de82-418c-9fd2-f12f7a8a6af6","vehicle_id":"a1b2c3d4-e5f6-7890-abcd-ef1234567890","event_count":14,"avg_speed_kmh":48.13,"max_speed_kmh":52.46,"harsh_braking_count":0,"hard_acceleration_count":0,"distance_km":1.36,"trip_start":"2026-10-10T23:38:39.430057528Z","trip_end":"2026-10-10T23:39:27.430057528Z"},{"trip_id":"4ce34c09-3ad4-41e9-b173-6647bb027a94","vehicle_id":"a1b2c3d4-e5f6-7890-abcd-ef1234567890","event_count":15,"avg_speed_kmh":47.48,"max_speed_kmh":51.56,"harsh_braking_count":0,"hard_acceleration_count":0,"distance_km":0.95,"trip_start":"2026-10-01T14:38:39.430057528Z","trip_end":"2026-10-01T14:39:21.430057528Z"},{"trip_id":"bba183be-1370-4cf6-bd55-eec5aa5b10f2","vehicle_id":"a1b2c3d4-e5f6-7890-abcd-ef1234567890","event_count":12,"avg_speed_kmh":48.25,"max_speed_kmh":51.75,"harsh_braking_count":0,"hard_acceleration_count":0,"distance_km":0.85,"trip_start":"2026-10-05T08:38:39.430057528Z","trip_end":"2026-10-05T08:39:23.430057528Z"},{"trip_id":"aaace7cd-0f6b-4788-a3e9-aa8a9d22a624","vehicle_id":"a1b2c3d4-e5f6-7890-abcd-ef1234567890","event_count":14,"avg_speed_kmh":47.35,"max_speed_kmh":52.5,"harsh_braking_count":0,"hard_acceleration_count":0,"distance_km":0.61,"trip_start":"2026-09-27T20:38:39.430057528Z","trip_end":"2026-09-27T20:39:23.430057528Z"}]